https://www.youtube.com/watch?v=w0FRRlQCmqE,Josy," Hi guys, it's me, Danny. I've been thinking about something for the past like a couple months honestly, and it's been kind of life changing for me, so I thought I would share it with you guys. So my friend was over last night, and she was telling me about how like in her life, she just wanted it to go differently, and she kind of wishes she was somewhere else in her life right now, and she feels like she's had so many bad days recently, like her life just kind of sucks right now, and she's very down like in general. And I told her this thing that I've been thinking of how you can either see your life as like a bad life, like I'm having a really hard time right now, or you can just see it as a bad day, and then tomorrow could be good or bad or whatever. And it's something I've been thinking for a while because I always used to do this thing where if I felt sad, I would like apply it to my entire week or month, and it was like I'm having a really hard time right now. Like I would always say that to Emma, and he would be like, Danny, like, yeah, you're having a bad day, but your life isn't bad. Like you were happy like a week ago, you're not necessarily having a hard time right now. And I was like, hmm, that's interesting. Like sometimes, yeah, if you're a freaking failing member dies or something, like yeah, that makes sense. Like you'd have a really hard time in life. But in terms of just regular life and normal issues that come and go mental health problems, like career stuff, whatever, things are constantly going up and down. Like even in the span of a day, you can have a horrible morning and a great evening, you know? And so the tendency to kind of label an entire life as bad or an entire time period as not good, I think is a little bit harmful to your mental health. And what I mean by that is that you can see things whatever way you want to see it. And this is kind of where my radical acceptance thing to my therapist talking comes in. He always talked about how like if someone hurts me, I can either view it as them trying to hurt me or I can view it as me just feeling hurt by something that somebody else did. And it kind of removes the responsibility from anybody and it just attributes the feelings to feelings. Does that make sense? So it's not like, oh, this person hurt me. This person is a jerk. This person should have done better. It's like, oh, I'm feeling a lot of hurt right now. I should probably like figure this out and talk to this person and fix our relationship or cut them out of my life or whatever. And there's not this like vindictive, angry view of the world. And the same goes for what I was talking about with my friend. Like when bad stuff in life happens, you can either view it as everything bad is happening to me. My life is so bad. Everything is so terrible. Or you can view it as, oh, I had a bad day today. I'm going to try again tomorrow. And even if you have 100 bad days, right? Even if your entire year has been horrible. You still don't have to view it as a bad life. And I know that that's hard. Like it's definitely a lot easier said than done. But if everybody could get to a point in life where they're just like, oh, yeah, I had a bad morning or I had a bad night. But tomorrow might be better. And if every night you went to sleep thinking, okay, whatever happened today is a relevant. Like it's over. It already happened. I'm going to try again tomorrow. I feel like we would be a lot happier like as human. I feel like there's this tendency to lean into your sadness a lot and to lean into your mental health issues because for so long, like mental health issues were just completely ignored. And like nobody wanted to talk about it. So nowadays in 2021, oh wait, it's 2022. Nowadays in 2022, everybody's like, we have to talk about this. My mental health is really bad. Everything is bad. I need to be sad. I need to express my feelings. I need to feel this right this second. Like my trauma is ruining my life. Like, you know, you guys see that stuff on social media all the time. So do I. I'm even, you know, responsible of doing that for sure. And people kind of started even hating on positivity. Like toxic positivity. And like, don't be so happy all the time. Like I'm sad and just let me be sad. So there's definitely some truth to that. Like movement. Like I'm definitely not saying that's wrong. But I think the goal should just be to have some kind of middle ground between that, right? And there's nothing wrong with kind of just putting your feelings away and saying, okay, I'm going to deal with that later. As long as you're still taking care of yourself. And that's again, kind of goes back to my thing of it's not a bad life. It's just a bad day because if you're just constantly living in your sadness and your issues all the time, yeah, it could be a bad life. And like you could definitely see it as that. Or you can just see it as I'm really struggling right now. And I'm going to deal with my feelings and whatever. But I still have a chance to make it better. And also, let's go beyond that. What even is the definition of a bad day? Like if you were sad that day, if you were angry that day, is it a bad day? Do you have to call it a bad day? Do you have to call it a bad morning? If you woke up in a bad mood, like I'm not saying everything has to be perfect all the time. But you could also just see it as a mood. You could see it as neutral. You could see it as you felt something. You know, somebody hurt you. You yelled, you screamed, you cried, whatever it was. Like you can see those things, but you don't have to label them as good or bad. I feel like the good emotions are like happiness and euphoria and joy and love and forgiveness or whatever that means. And then all the bad feelings are like anger, sadness, jealousy. Like it's like all that stuff is labeled as good or bad. And I understand why some things are labeled as bad. But you also don't have to do that. It doesn't have to feel good, but it doesn't have to be bad. It can just be I felt this way today. Today I had a shitty time. You know, I spent the whole day in bed and it didn't feel very good. Tomorrow I'm going to try to do better. And if the next day you still don't do better, you just keep going because I always tell Emma this like, what the hell else are you going to do? Are you going to stop? Are you going to give up? No, you're not going to give up. You're not going to die, right? You're just going to keep living. So your options are to keep living and to not try and to just say that you have a bad life and everything sucks and that's it because that's what I always used to do. Or you can say, okay, I'm going to keep trying tomorrow and I'm going to keep trying to get better. And I'm not going to get so down on myself if I fail. And if I miss the mark and maybe today I didn't do some crazy self improvement thing and oh, I spent the whole day in bed. I'm a horrible person. Like you don't have to feel so bad about yourself because there's not this expectation. And that all just goes back to my acceptance thing. Like you don't have expectations of what your life is supposed to be. Or who you should be, who other people should be, where you should be in your life. Like I'm going to look at everybody else who is 21 years old and has a savings account or a perfect relationship or whatever. And I'm going to feel bad about myself because I don't have a savings account and I don't have a perfect relationship, right? Like that's a tendency. That's what everybody does. That's what I do every single day. I look at other girls' bodies and I'm like, I wish I looked like that, you know? And it makes me feel bad about myself. But if I break it down, like I'm only feeling bad about myself because of the comparison. If the comparison wasn't there, if I didn't know that other people existed, I wouldn't feel bad about myself because I would just be. And that's it. So if you just stop expecting everything to be a certain way, you won't be let down as much. And I think you'll appreciate life more because it's not going to be like, oh, I was so sad today. It was a horrible day. It could be like, oh, I had a very transformative day actually. I cried the whole day and I actually feel a lot better tonight. There's always a way that you can spend things not necessarily to be positive, but just to not be so sad all the time. And when I started thinking like that and trying to complain less, I've just noticed a huge shift in my life in my mindset. So yeah, if you guys are feeling like shit all the time, maybe this will help you. Maybe it won't. I don't know. But I've just been thinking about it a lot and I hope that you guys understand what I'm saying. Before I go, I have a sweatshirt that I made and it's my merch. And it's almost sold out. There's literally 10 size smalls left. Like there's very few unisex size smalls left. It's sold down every other size. So I want to make a new hoodie. I might want to restock this one. I'm not sure, but these size smalls are just hanging on by a thread. So go to the link in my description and check out this hoodie. And if you're a unisex size small, which is kind of just like a min size small, it's like a bigger women size small, go to the description and check it out. Okay, I love you guys. Thank you for listening to my rambling. Goodbye.",how i stopped hating my life so much,22.02.2022,Dani Calleiro,Woman,20s,8:03,8,"0,9933"
https://www.youtube.com/watch?v=xthJFgAnRVw,Josy," Hi, I really hate my life at this point. I hate what I've done in it. I hate what it's going and so far it's going nowhere. I hate that I have a mental illness. I hate having very little friends. I mean most of our friends are either at the Foreign Health or at church. I hate that I don't have a girlfriend or having had much experience with sex. I mean I hate that I don't that I can't do anything about it. I feel feel feel like a failure. I mean it makes me want to contemplate taking taking my life. It's really getting to that point and unfortunately my life is not mine to take. I just wish the Lord would come soon to get to get me out of this slurker. I hate that nobody looks at me as anything but a freak or a creep. I mean there isn't much more I could say.",I hate my life,20.11.2021,Vic George The ND Guy,Man,60s,2:48,10,"-0,9346"
https://www.youtube.com/watch?v=c9OYuxmjYWE,Josy," Part of my junior year and part of my, in all of my senior year, I was attending high school on the Basin Japan. While I was there, I met this woman, this girl, and got to know her through her brother. She was a big girl and everything. She got a job in the NCO club where I was watching dishes. She was Boston tables. We flirted all the time and we were talking to her from Cut-Off. We really had a lot of chemistry. But I was just a shy, fat, sit face. I mean, no self-esteem at all. Get home. And I never did anything about it. And one night I was at the movie theater and I saw her in a distance of the part of the parking lot walking in to go see the same movie. She was by herself. And I sat, I was sitting, I got out of the theater and I sat, I saw what she was sitting because it was just like the big knee on the side. Come sat with me. And I didn't do it. I sat there, just too shy and too insecure. I was rooted in this chair. I was a little bit of a theater. And then I watched the movie. One home didn't think anymore about it. I was used to doing crap like that. My teenage years of terrible. And then I saw her at the end of the year. I asked her if she enjoyed the movie. She said it's sad. She came in and she was throwing trays around and slamming them. She was pretty angry. And finally she came back a little later and she calmed down. She said, you know, guys are supposed to make the first move. And that was the end of that. You know, I know. So on the old line, I'm 63 years old and I still think about her and I still think about that night. And I wrote a story about it.",The one regret from high school that I still think about all these years later,08.09.2023,Lawson Wallace,Man,70s,3:01,8,"-0,8442"
https://www.youtube.com/watch?v=lFcOnXMG9co,Josy," I'm 30 years old and looking back in my 20s, in a way I completely wasted them. In this video, I'm just going to explain how I did that, what was going through my mind, my belief systems, and why it's actually a paradox and a good thing that I wasted my 20s. The reason for that being that it led me to where I am today. Let me explain. My entire 20s, I was driven basically by my ego and it's attempt to receive external validation from the world and other people. My ego was very fragile. It caused me to put on many different masks where many different costumes, metaphorical costumes. To impress other people, I wanted people to view me certain ways. I wanted them to view the way I thought I should be viewed. I put on these masks, hoping that they'd see me for who I wanted them to see me as. There's always something missing inside of me. I had a normal childhood. I had a great childhood, great family, a lot of friends, loving family and friends, good school, good opportunities. But there's always something missing. There's always something missing in here, so I sought it from the outside world. In my early 20s, I decided to go to school for something that I knew would make me a lot of money that would make my parents proud, that would make my friends think that I was successful. I went to school for that and I got a job afterwards for something directly related to what I went to school for in hopes that people would view me as successful, view me as somebody who made it. I did all that and I got the job and I worked the job and I made a lot of money all for other people and all for the way other people viewed me. The thing about that is that people get to decide whatever they want to think about me. They get to believe what they believe. Even though I'm trying to do this, trying to make them see me a specific way, they may never not see me that way. That's why it's very futile to seek external validation because at the end of the day, I'm not the one who gets to decide what other people think of me. I went and got this awesome job that at least I thought was awesome and I thought other people would think is awesome. In reality, I did not enjoy. I didn't get any fulfillment from it. I only got money from it and that money just fed into my consumerism and materialism which was also external validation seeking because once again, I wanted people to see me as somebody who is successful. I wanted to be respected. I was sort of the center of the universe in other people's worlds. I was putting myself. I wanted to be the center of attention in other people's worlds and once again, it doesn't work that way. I don't get to decide what the center of someone's universe is. But I spent my whole 20s doing that. I did everything based on external validation and I had a complete external locus of control. I went and I bought a fancy sports BMW $80,000 vehicle because I wanted people to see that and sort of have their jaws drop. He's got that car at that age. Man, he's made it. So I had the house, I had the car. I went and bought a bunch of expensive outfits. There were times where I was probably wearing between all the items of clothing that I spent money on. I was wearing close to a thousand bucks between all the layers of shirts and my pants and my fancy shoes and the fancy chain and rings and accessories and jacket. It was a lot of money I spent because that's what I thought people, because that way I could kind of control what people were thinking of me. Basically what I was doing was I was going to the circus dressing up as a clown and performing for people and I was making an identity, multiple identities throughout the course of my 20s. Based on what I wanted people to see me as, I was a clown at the circus. And the thing about clowns that are professional clowns, they do all that. They dress up and then they go to the circus. But then at the end of the day they realize that that's not who they are. They wipe the makeup off and then they go home and live their lives. I never did that. I was 100% clown all the time. I would play tricks on myself and say, this is who I am. I'm this rebel, this guy who marches to the beat of my own drum. I even got tattoos because I thought people would think I was cool. I had an image I had to give off. I had many expectations of people to see me a certain way. Anyassure, I did. Sometimes get some validation from people. People would ask me what my job people would compliment me on my vehicle or the way I looked. But at the end of the day it was nowhere near of what I expected of people, of the attention that I thought I should get. Poppies, come on. My whole sense of purpose and being was coming from the outside. But it was all on my terms. People had to see me the way I wanted to be seen. And nothing was coming from within here. This led to a lot of suffering, pain and depression. It was all self-inflicted. I self-medicated with substances, alcohol and other illicit substances. My entire 20s, in my early 20s, it wasn't that bad. But as I progressed through my 20s, it built the depression and the anxiety built. So I sort of treated all this pain with substances. And they worked for a time and then they sort of lost their effect. When I was about 20-70, anxiety that had been building in my body because of the way I was living my life, it had built in my body so greatly that it started mapping. I was manifesting in severe physical symptoms. One day I woke up, while I was walking down my stairs and I lost my balance and went into the wall. And for three months, I had no balance. I had to walk. Like I had to widen my stance and walk, just to walk in a straight line. Looking back on it now, it's actually, I look back and it was, I can kind of find, see the humor in it. At the time, it was complete darkness. The anxiety manifested in other forms to it. It manifested as, you know, my whole body was spasming. I would feel sensation of paralysis in my limbs. I would get blurry vision and I would get partial or complete and or complete blindness in one, or both of my eyes. This usually happened at night. It was very scary time. The doctors thought I had MS and there was a lot of testing that was done with no evidence. And one doctor thought that I should go on some volume for the spasms I was having. And it fixed everything. The volume is an anti-anxiety medication and it fixed everything. All my symptoms were gone. Like within two days of on-valume, everything was gone. So the doctor, that doctor, knew right away that I was suffering psychosomatic anxiety disorder and that's what it was. So I didn't start as self-medicating with. I then started medicating in my late 20s heavily with alcohol and other substances that inevitably led to a mental breakdown when I was 29. And I ended up in a detox facility and rehab facility for seven weeks. And that was the point where I sort of had a bit of a shift and then I sought therapy. And I went, I did some heavy therapy for two years. And that is where I learned to sort of disconnect from everything. So my entire 20s I was living through a great deal of pain and suffering and it was a good thing. So I suffered a great deal through my 20s and it was all worth it. Because it led to my breakdown, which inevitably led to a mindset shift, complete belief system reset. I thought I had to believe certain things to be who I was. I was not living as my own person. So this breakdown led me to this and I was able to sort of rebuild and uncover who I truly was. I was able to disconnect from everything that I thought I needed to be. And I was able to disconnect from the fact that I can't control what other people think and what they think of me. That's not any of my business what people think of me. I can only be who I am and people are going to think whatever they want to me whether it's good or bad. That's out of my control. So yeah, in a way I wasted my 20s but in a way it wasn't a waste at all. It wasn't a waste at all. It's a great paradox of life. Because if I never went through what I went through I never would have had the breakdown which led me to where I am today. And where I am today is much better than where I was in my 20s. And a lot of people they go through life struggling, never really understanding why. And I should speak for myself because everybody's life is different. But if I never would have had that breakdown I could have went through my entire life lost. So I'm thankful that I went through the pain and the suffering. And I'm thankful for where that has led me today. So tell me what you think does any of this relate to your experience? The whole purpose of this video is to if this can relate to you or anybody. I wanted to share this experience because maybe there's somebody out there that can kind of relate to what I'm saying.",30 Years Old: I Wasted My 20s,10.08.2021,David Masson,Man,30s,9:38,8,"0,9915"
