Link,Name of the researcher ,Transcribed text,Title of the video,"Date posted:
DD/MM/YYYY",Youtuber:,Gender:,Age:,Length of the video,Confidence score 1-10,positivity
"recovering from a depressive episode ☁️ deep cleaning room, facing my anxiety and fears - YouTube",Marysia,I didn't think I was going to make this video because this is just [ __ ] embarrassing behavior for me to be a normal person I have to go out into the [ __ ] Sun are you guys like this to camera moment I like summer when I'm hanging out with friends but I don't like summer when I am alone oh my God I want to clean out this entire bedroom I have so much anxiety I feel like [ __ ] I need to get my life together bro okay tomorrow's a new day tomorrow let's get our [ __ ] together all right I just [Music] I slept at 9:00 guess when I woke up I woke up at 8:00 a.m. and then I slept slept again woke up at 10: I just have no motivation bro oh Splash oh that's we're going to add the sausage [Music] [Applause] [Music] okay we have a few [Music] items okay I just finished packing the deop orders I was going to clean up this room okay look at how messy it is yeah I was thinking like cleaning up right now time is currently 12:42 and I was like you know what let's go to the gym [Music] it's [Music] he [Music] yes hi guys I'm currently out I just got my nails removed today my housemate she has time so we're going to go grab dinner at this like new Japanese restaur restaurant and honestly it's usually so packed hopefully if we go there for lunch it won't be as packed I want to finish cleaning up my room and then afterwards I want to wash my bed sheets like laundry all of that because my laundry has been packing up I have a feeling that today is going to be a very productive day I never okay I just put my name on the wait list at this Ramen place I think currently there's six tables ahead of us and they told us it's going to take like 20 minutes we have a Lem Prett good you have you seen that wait [Music] question I like yeah stop [Music] stop okay I just came back and currently I want to do my laundry but both of the washers are freaking taken so I have to wait 1 17 minutes 1 27 I'm just going to leave my stuff here I don't think anyone's going to take my [ __ ] it's l dirty ass clothes [Music] okay I was able to clean up that section of clothes and I try to like hang like the clothes that I'm going to like wear the most often [Music] I'm currently packing Depot packages right now what I'm planning to do is that I'm going to go drop these off and I'm going to do some grocery shopping and my room so far is fine I think I'm I'm getting close I forgot to wash my bed sheets oh my God that was like the main thing the mouth clothes I had to wash was a lot it wouldn't even fit into the washer machine anyway let's start going right now let's ship y'all out I just shipped off 3dot packages [Music] [Music] [Music] [Music] uh can you help reach like a on top thank you oh my God they sold out with my favorite that look fine mineral water this one I don't know how to say it slic PR I don't know how to say it but this is my favorite [Music] bra yogurt yogurt gra one of these they were almond milk and I think that is it for grocery [Music] the job they pull [Music] a for course foreign [Music] [Music] [Music] [Music] I just picked up oh my God I picked up my laundry it's currently 8:00 I'm going to cook some Turkish eggs because I am so hungry that was good that was good [Music] [Music] n [Music] la [Music] [Music] n [Music] okay it is currently 11:00 p.m. right now and I think I have officially cleaned up my room okay hey guys um I have a call soon and I'm currently getting ready later we're going to head to the gym so exciting also I tried out a new makeup style I don't if you can see it's a little different than how I usually do my makeup I don't have any questions [Music] fore spe spee speech [Music] one thing I will never miss about the United States is how loud people speak liter I go to go to bed but like these girls were just talking so loud outside it echoes okay is it ever that necessary to be talking so loud at 1200 a.m. in a residential area where the [ __ ] voices will Echo Rachel that's so funny babe we can all hear your [ __ ] conversation about how you're talking about how this guy is so [ __ ] hot nobody gives a [ __ ] I shut the [ __ ] up literally so I'm [ __ ] awake so guess what we're doing I bought this like box of like strawberries and literally I ate them all within a day with these days I get so easily influenced if I see a recipe that I I like I like just cook it I've been seeing this go viral on Tik Tok but I don't know where the [ __ ] to buy this it's like that Viral mango ice cream here it comes the airplane oh my God so if you look too closely it gets a little scary hey guys okay I just came back from the gym I actually did my makeup within 20 minutes bro that's crazy I had a dinner reservation with my housemate originally we're going to go at 7:00 but she got off of work early so we're going to go earlier yeah yeah say hi say hi I also like my hair actually my hair's actually really disgusting it's genuinely like [ __ ] like doused it in like like Hairspray and [ __ ] it's actually [ __ ] disgusting but you know what I don't usually do this anyway so it's going to be fine oh I think my housemate just left wait hold on did she just leave oh my God I'm going to call her where is she going where she going she said oh my God come down I don't want to rush you she was so fast like damn wallet and oh my God my charger [Music] rise roll Master oh okay we are currently going to get iner you know you're adulting when you make a reservation oh that's kind of creepy but it's kind of cool have a corner [Music] excuse [Music] me I just knew that [Music] was me make me laugh [Music] good good wait then maybe yours better then [Music] she just had my therapy session my therapists give me such lifechanging advice today she met mentioned how I might be scared of being friends with people for too long because of how they might see me they might know my flaws how I might need to open up for me I never even realized that cuz I'm always like I want to be friends with people long term and it's still true but maybe subconsciously I'm scared of them seeing my flaws my therapist was saying how like long-term friendships usually there is something that you don't like about the other person it is probably not like a big thing they're not exactly a clone of yourself there's going to be some differences because of that that makes a friendship very valuable despite the flaws you still love them of course like you know there are certain deal Breakers and that's for you to decide okay okay girlies so girlies what did we think of the Vlog via how are you feeling right now very good question I'm very happy you asked it is currently Thursday June 6th 9:33 p.m. I actually just came back from a solo walk so it was nice to take myself on a little walk I haven't done that in a while and I forget how nice that is and I am feeling better now I am feeling more motivated now I just have to force myself to do it to be okay doing it and I think like maybe I just ate something wrong in the past 2 weeks something happened and I just I just spiral I'm just like oh my God everything's going to suck again like I said before at the very beginning of the video the goal of these videos when I make them is to prove to myself emotions are like this okay there's the lows and there's the highs and yeah and I just need to keep telling myself that things are temporary and honestly these days I think I've gotten better at navigating these awful well actually you know what no because when the emotions suck at that moment it really sucks like it just feels like you can never get out of it but I hope to really just get to the point where it's like like even if I'm at an alltime low I can tell myself that hey hey this is just temporary you're going to get up there again you're going to feel better just because it's bad doesn't mean it's not going to be good like you just got to give it like you know a week or two and here I am and of course during a week or two you need to try at least getting yourself out there if any of you guys are going through something similar like I am um I hope that video helps you everything's temporary okay everything is especially your emotions like you're feeling very bad it's going to get better but you have to also put in the actions of trying to make yourself feel better I'm generally grateful that um I felt better today and I'm happy I'm back into making like these little little tiny Boston Vlogs because I kind of miss doing those and I feel you guys miss it too just be in the comfort of my own home,"recovering from a depressive episode ☁️ deep cleaning room, facing my anxiety and fears",09.06.2024,Via Li,Woman,Early 20s,13,7,"0,9999"
https://www.youtube.com/watch?v=RSvMhNjatWs,Marysia," You are not a machine. You are more like a garden. You need different things on different days. A little sun today, a little less water tomorrow. You have a fallow and fruitful season. It is not a design flaw. It is wiser than perpetual stainless. What does your garden need today? Everything could be going well lately. Maybe you have been consistent with your goals. You have been doing all in school or you have been keeping up with the fitness. But one morning, afternoon or evening, that feeling inevitably comes again. Or maybe there was something that reminded you of a bad past event and brought up old feelings of sadness and anxiety. Sometimes it even feels like whenever you feel genuinely happy, something bad is bound to happen. Maybe something occurred that didn't go how you think it would or didn't go as planned. In your job, relationships or school, and it seems like all the progress you've made has dissipated or doesn't have any meaning. Your logical brain knows it's not true. But no matter what, the emotions can take over and lead you in a very dark place. And I think here we go again. Honestly, this happened to me recently and I know I'm not the only one who goes through this. But I'm not going to let myself be sucked into a dark hole. So I picked up my camera so you can join me on a few days of trying to feel better. I'm not going to let myself be sucked into a dark hole. But I'm not going to let myself be sucked into a dark hole. I have a spoon inside my head. Life can be tumultuous, excited, confused, or disorderly. However, calm and stable someone's life appears, a closer look will reveal up and down. They're all part of the human experience. I like to sometimes imagine the ups and downs of life like a heartbeat. If it was a straight line, then our life would be over, like one on a heart monitor. I've accepted the inevitability of this, but thinking about the downs when you're on the peak really takes away from the moment of happiness. I struggle a lot with thinking about the what-ifs, so much that it spoils the very happiness in front of me. I just finished with practice and was kind of sad because it was the last practice of time. At the same time, since I've been aware of this phenomenon, I can use it to my advantage and see it the other way around to motivate myself through a challenging period. At a low point, I know that there will be an up sooner or later, and it's inevitable too. I've come over a bit, I love it, it's so easy. I can't do it, come on, I'm gonna have to see you start now. Take me home. Go down the road when you feel so indigenous. 1. Find things to look forward to. Sometimes when I enter a dark place, it seems like the future can be really hopeless. Events out of your control like the impossible cost of living or environmental concerns can bring me down a lot. The accomplishments that I do have seem so meaningless in the grand scheme of things. Therefore, I try to look closer, at smaller, even more superficial things to get through my life day by day. Every Sunday, a new episode of my favorite show releases. And recently, I've been looking forward to journaling every night to release my creativity and my thoughts. Some other things could be sports games or something small you're saving up to buy. I know people say to live life in the present, and that works sometimes, but during particularly stressful moments in time, it can be more beneficial to have something to look forward to. This is Amlant's Atherapist, Lanaya Smith Crawford. I'm sorry I just cried. I'm going to make my bed. I'm always telling myself I'm a boring person and I don't like spontaneity. I like routine and order and being comfortable, but sometimes I think that's just something I've been telling myself to avoid going out of my comfort zone. I've had myself going day after day doing the same things and of course that's going to be boring after a while. It feels like I'm just going through the motions of everyday life, but not truly living. So this time, I threw out the planner and I decided to take a spontaneous trip just to my best friend in different city and also visit my parents because I haven't seen them in months. The excitement and spontaneity was so refreshing because it was rare that I didn't plan in advance. I felt more relaxed, more flexible and doing different things made me feel like I wasn't missing out on moments of joy for once. And I'm not the only one who feels this way. 72% of people said they feel happier after they act spontaneously in some way according to a study conducted by one poll. So maybe it's time to veto the schedule for once. So I'm not the only one who feels this way. I'm not the only one who feels this way. I'm not the only one who feels this way. I'm not the only one who feels this way. I'm not the only one who feels this way. I'm not the only one who feels this way. I'm not the only one who feels this way. I'm not the only one who feels this way. I'm not the only one who feels this way.","try to feel better with me :) ♡ healing morning routine & habits, recover from a depressive episode",17.04.2022,Rebecca Jay,Woman,Early 20s,8:47,8,"0,9982"
https://www.youtube.com/watch?v=baGAlh2Q5vM,Wentao,one of the biggest paradigm shifts that I have made about happiness is that it's not something that we feel it's actually something that we do it's a skill a muscle that all of us can strengthen and improve and to help you do that I've created this really simple five-minute happier workout that you can do wherever you are without having to change your life go away to meditate for a year having to you know cleanse your soul or organize everything perfectly you can do it right now in fact along with me so here are the five steps the first practice is acceptance and it's the practice of being with your feeling and with yourself just how you are not having to change negative into positive not having to shift or struggle but just how you are and to do it you simply spend two minutes being still and silent if you're comfortable please close your eyes but you don't have to we don't spend a lot of time in our life just being still and being quiet and so two minutes of stillness and silence is a great way to help you connect a little bit closer to how my feeling it's kind of like your chicken and then to practice just being there accepting of how you feel the second practice is gratitude now an overwhelming amount of research studies showed that when we practice gratitude our brains release dopamine and serotonin both of which make us feel really really good and the more regularly we practice the easier it is for our brain to do this on its own so when you practice gratitude as part of your happier workout I ask that you do two things first is you have to capture your gratitude in some way so maybe jot down on a piece of paper one or two things that you really appreciate about your life you can also say it to someone else you can share with another person something you're grateful for but you have to capture them the second piece is the more specific you can be about what you appreciate the better so think less I'm really grateful that I'm alive and more I'm really grateful that this morning I got to enjoy my favorite cup of coffee undisturbed for a couple minutes the third practice is what I call intentional kindness now we all know that it feels really really good to do something nice towards other people but in this practice you're actually focusing on your intention you're doing something by focusing all your intention I'm just doing something kind now to do something right now maybe it's something that is really simple you send a text to a friend and you check in and see how you're they're doing it's amazing what a tiny act of kindness like that can do to the recipient you know we live in these lives we're really busy we're running around it feels really good for someone to check in on us it feels really good to be seen if you can't do something kind right now as part of your happier workout put it on your calendar to do later it might seem strange to schedule kindness but I actually think it's really important we schedule meetings we schedule errands why not schedule kindness so as you're a third step and you're happier work out either do something intentionally kind or schedule it for later today your fourth practice of your happier workout is call it what I call the bigger why and the bigger why is connecting to a sense of meaning in our lives now often we think of meaning as something you know out there like we have to go out and find our life purpose but what I found is the best place to look for meaning is within our lives so what I'd like you to do is think about some of the things on your to-do list it could be something you're doing for work or something you're doing for your family or for a friend and now consider how that one task helps someone other than yourself you know maybe your project at work is helping your colleagues or customers maybe one of your errands today is to get groceries and the way it's helping your families that you're gonna make a nice dinner with it later when we connect to a sense of meaning we not only feel happier but research shows it actually makes it easier for us to get through the money to do this on our list the fifth practice in your happier workout is self-care now many of us have challenges with practicing self-care and self compassion because we feel like we don't have enough time or we feel like if we beat ourselves up or if we talk to ourselves harshly somehow we'll be more motivated to do better and to improve and in fact research has found the opposite research has found that when we treat ourselves with kindness and compassion with the same kindness and compassion that we usually reserved for people we love we're actually more likely to get things done or more likely to improve we're more motivated to do all of the things that we want to do so it's part of your happier workouts spend a minute saying a couple of supportive things to yourself it could be something as simple as hey I know you're gonna have a rough day today I'm just reminding you that you're okay and we'll get through it or it can be something where you express gratitude to yourself for yourself find something that you appreciate about yourself and say it to yourself as part of the self-care practice of your workout and finally when you're done with your five steps of acceptance gratitude intentional kindness the bigger why and self-care take a moment to just thank yourself for taking these five minutes out of your busy day to do something that is not just scientifically proven to improve your well-being but also will contribute to your productivity your creativity research has shown happier people have better relationships at both at work and at home and also consider the fact that by cultivating these practices through the simple workout in yourself you're helping people in your life experience some of that happiness as well because research shows that happiness is contagious so when you do this happier workout it doesn't just cultivate your own happier skills but it can be the beginning it can be the star at the inspiration for people in your life to cultivate theirs [Music] you ,Simple Habits to Be Happier in 5 Minutes | Nataly Kogan,29.03.2018,Nataly Kogan,Woman,40s,06:09,7,"0,9999"
https://www.youtube.com/watch?v=7e1-WiLyizw,Wentao,happiness is an emotional response to an outcome if i win i will be happy if i don't i won't it's an if then cause and effect quid pro quo standard that we cannot sustain because we immediately raise it every time we attain it see happiness happiness demands a certain outcome it is result reliant and i say if happiness is what you're after then you're going to be let down frequently and you're going to be unhappy much of your time joy though joy is a different thing it's something else joy is not a choice it's not a response to some result it's a constant joy is the feeling that we have from doing what we are fashioned to do no matter the outcome now personally as an actor i started enjoying my work and literally being more happy when i stopped trying to make the daily labor a means to a certain end for example i need this film to be a boxed office success i need my performance to be acknowledged i need the respect of my peers all those are reasonable aspirations but the truth is as soon as the work the daily making of the movie the doing of the deed became the reward in itself for me i got more box office more accolades and respect than i ever had before see joy is always in process it's under construction it is in constant approach alive and well in the doing of what we're fasting to do and enjoying it define success for yourself you already like that one define success for yourself now check this out i'm in uh south of new orleans uh a few years ago and i went to a voodoo shop uh and they had this this this wooden partition against the wall these columns and in these columns were all these vials of these magic potions right and the headings above each potion defining what they would give you were things like fertility health family legal health energy forgiveness money guess which column was empty monet let's admit it money is king today it's what make the world makes the world go round it is success the more we have the more successful we are right we so often focus on failure don't we we study failure obsess failure we dissect failure and our failures dissect them so much we end up intoxicated with them to the point of disillusion and when do we write in our diary usually when we're depressed what do we gossip about other people's flaws and limitations we can dissect ourselves into self-loathing if we're not careful i find that most of the times our obsession with what is wrong just ends up breeding more wrong more failure the easiest way to dissect success [Music] is through gratitude giving thanks for that which we do have for what is working appreciating the simple things we sometimes take for granted we give thanks for these things and that gratitude reciprocates creating more to be thankful for it's really simple and it works now i'm not saying be in denial of your failures no we can learn from them too but only if we look at them constructively as a means to reveal what we are good at what we can get better at what we do succeed at now personally i've read a whole lot of my bad reviews all right i've had quite a few written by the more talented critics they are the ones who give constructive bad reviews they reveal to me what did translate in my work what came across what was seen or what wasn't now i don't obsess on the unfavorable aspect of their youth review but i do see what i can learn from it because their displeasure actually uncovers and makes more apparent what i do do well what i am successful at and then i dissect fact all right life's a verb we try our best we don't always do our best [Music] ,5 Minutes of Motivation | Matthew McConaughey - THE SECRET OF HAPPINESS,27.07.2022,Matthew McConaughey,Man,50s,04:50,8,"0,9985"
